{"session_header":{"schema_version":"PS-SESSION-2","session_name":"PS-MF-W05 | Product Closure","target_program":"MATH_FOUNDRY","phase":"T0_COUNTABLE_REPLAY_COHORT_1","iteration_id":"CAL-BR-009-v25-b53ab205","iteration_number":9,"role_id":"MF05","goal":"Replay C1 closure prerequisites and VerifiedProduct gating semantics under Math Foundry 3.1.1, report defects, and produce one countable T0 calibration report without C1 scoring.","plan_id":"0aa341106cfc5b104ab9ca9c2ae116d490a258685e28d26d5435860c53bb12aa","runtime_state_id":"9d0a88cc9001295b5e4c0f4163e83c0fd64ce04521e34230ad3539af14f3dfaf","model_target":"GPT-5.6 Sol","reasoning_effort_target":"EXTRA_HIGH","model_binding_status":"PARTIAL_UNVERIFIED","execution_mode":"SAFE_REPLAY_ONLY"},"task_network_plan_id":"0aa341106cfc5b104ab9ca9c2ae116d490a258685e28d26d5435860c53bb12aa","cohort_id":"CAL-BR-009-v25-b53ab205","worker_id":"MF05","report_id":"PS-MF05-CAL-BR-009-v25-b53ab205","generation_seq":9,"generation_head_sha":"67bcfef1a5a1e65c9cc4adb1a2f308ec51c70c3f","worker_branch":"ps/work/CAL-BR-009-v25-b53ab205/MF05","assignment_id":"PS-BRANCH-CAL-BR-009-v25-b53ab205","assignment_git_identity":"a467f2b50d08bc3ae36d7490dab3d118a9af1f9b","parent_state_git_identity":"1b2f5bacbe70eabb1828ee3f643a6959fad83284","control_manifest_id":"CTRL-CAL-BR-009-v25-b53ab205","control_manifest_git_identity":"df7d03a4e92fe410960779be90497313fdc23448","network_checkpoint_id":"59e43885d42bf8da755acb0792272913d95d50f7ed013c702364f38ce2eef905","runtime_state_id":"9d0a88cc9001295b5e4c0f4163e83c0fd64ce04521e34230ad3539af14f3dfaf","visibility_token":"3ffcad2d8bd1fe2ac4142aa71a0b656a","worker_auth_scheme":"PS-HMAC-SHA256-CANONICAL-REPORT-2","worker_auth_commitment":"473363d1e1fc0aae9e9df22da0cbd5f8695491863ff6cf82f2bc0a6ba86326f4","worker_auth_proof":"5a5bf8c8bf772037bf8899273f0d06d074d75c93d154eb459f9b2be6e0fe6cd7","status":"VALID_ASSIGNED_REPORT","mode":"SAFE_REPLAY_ONLY","evidence_tier":"T0_REPLAY_CONTROL_PLANE","executive_status":"ZERO_DELTA: MF05 replay found no evidence-backed stable defect in the Gen9 C1/product-gating control surface; C1 remains gated and NOT_MEASURED.","fresh_evidence_ids":[],"private_manifest_id":null,"private_manifest_git_identity":null,"task_ledger":[{"task_id":"MF05-T0-C1-GATING-REPLAY","status":"PASS","summary":"Replayed the frozen C1 prerequisite and VerifiedProduct gating semantics only; no C1 score or product-closure claim was made."},{"task_id":"MF05-T0-PRODUCT-ADMISSION-REPLAY","status":"PASS","summary":"Confirmed the frozen authority order requires real Foundry execution, independent verification, statement fidelity, and then product admission; software replay qualification alone is insufficient."},{"task_id":"MF05-T0-STAGE0G-OWNERSHIP-REPLAY","status":"PASS","summary":"Confirmed MF05 future ownership includes Stage0G bindings, but the active assignment remains T0 replay-only and does not authorize Stage0G execution or activation."}],"issue_ledger":[],"test_ledger":[{"test_id":"POINTER_AND_ASSIGNMENT_IDENTITY","status":"PASS","details":"Main pointer resolved Gen9 and exact G; frozen control and assignment Git identities matched the canonical pointer."},{"test_id":"CONTROL_RELEASE_FREEZE","status":"PASS","details":"Control release commit/tree matched the frozen manifest; release-to-G changed only the Gen9 assignment, control manifest, and liveness contract, leaving the required frozen control set unchanged."},{"test_id":"BRANCH_ISOLATION_PREWRITE","status":"PASS","details":"Generation branch and MF05 worker branch were both identical to exact G before the first receipt; assigned report path was absent."},{"test_id":"LIVENESS_CONTRACT","status":"PASS","details":"Frozen Gen9 liveness contract exists and binds MF05 to the assigned branch/path with a 2026-08-21T16:09:00Z start and 2026-08-21T16:55:00Z deadline; this run began inside the eligible window."},{"test_id":"AUTH_COMMITMENT","status":"PASS","details":"SHA-256 of the prompt-private capability bytes matched the frozen MF05 public commitment; the secret was not printed or persisted."},{"test_id":"HMAC2_CANONICAL_REPORT","status":"PASS","details":"Whole-report HMAC-2 was computed over sorted-key compact UTF-8 JSON with only worker_auth_proof removed."},{"test_id":"SIGNED_FIELD_MUTATION","status":"PASS","details":"Mutating a signed report field changed the recomputed HMAC, so the original proof does not authenticate the mutated report."},{"test_id":"SCHEMA_VALIDATION","status":"PASS","details":"Candidate report validated with Draft 2020-12 semantics under pinned jsonschema==4.26.0 before the create-once write."},{"test_id":"STRUCTURAL_STATUS_OBSERVATION","status":"OBSERVED","details":"At exact G, supernova/liveness and supernova/branch-generation were success; worker/verify/integrate/consolidate contexts were pending pre-write. Pending contexts were not reinterpreted as PASS."}],"plan_alignment":[{"requirement":"SAFE_REPLAY_ONLY","status":"PASS","details":"session_header.execution_mode and report.mode are both SAFE_REPLAY_ONLY."},{"requirement":"ZERO_FRESH_PRIVATE_BENCHMARK_RESEARCH","status":"PASS","details":"No fresh evidence, private-manifest reads, benchmark executions, or deep research were consumed."},{"requirement":"NO_C1_SCORE","status":"PASS","details":"C1 remains BLOCKED_UNTIL_JUSTIFIED after E1/G1 succession; no C1 benchmark or score was produced."},{"requirement":"PRODUCT_ADMISSION_SEPARATION","status":"PASS","details":"KERNEL_VALID, software qualification, independent verification, statement fidelity, and product admission were not collapsed into one claim."},{"requirement":"SYMMETRIC_FIDELITY_COST","status":"PASS","details":"Future C1 evaluation must charge statement-fidelity/checker costs symmetrically across applicable arms; no arm was executed here."}],"evidence_and_provenance":{"canonical_pointer":"main:state/CURRENT.json","generation_head_sha":"67bcfef1a5a1e65c9cc4adb1a2f308ec51c70c3f","control_release_commit_sha":"b53ab205a68dd0346fc33e75655bdc781c02eda3","control_release_tree_sha":"399432daeae28777f3bd0604a12ef64aafb5e9ff","control_manifest_path":"control/CAL-BR-009-v25-b53ab205.json","control_manifest_git_identity":"df7d03a4e92fe410960779be90497313fdc23448","assignment_path":"assignments/CAL-BR-009-v25-b53ab205.json","assignment_git_identity":"a467f2b50d08bc3ae36d7490dab3d118a9af1f9b","roles_git_identity":"04a7e3edeb394507a7dc8e6ee697c65ed05db01d","worker_auth_git_identity":"9498d1d49b8636a3a313dc63be89f4433330c230","session_standard_git_identity":"3ac507a31438c8eba5497c72a61a7979ab1a3a52","branch_worker_protocol_git_identity":"2103ec2cc4dcdf623f32e76878bd0a01f7a66d15","branch_report_schema_git_identity":"62608e780c7d585e55bfaf48c9b10940cd84346e","benchmark_registry_git_identity":"461c5bd695df5ac849e27df80799ed12871d281a","liveness_contract_path":"liveness/CAL-BR-009-v25-b53ab205.json","liveness_contract_git_identity":"c91ee15f0e66f0297ea5ea5f31f8f8a9969f9b86","runtime_update_receipt_path":"runtime/updates/GEN8-FOUNDRY-3.1.1-REPLAY-BINDING.json","runtime_update_receipt_git_identity":"ffcae5b57a43e3ad81a0506f62ce6dcdb02fe511","foundry_sha256":"57c57394bda484c4ec4613c312080682a37670ebb6cec06d061979e39f1ec64f","mastermind_sha256":"026a4d845ac021baa9f90c7c48c1f77f19f57065d257e45824025f5f467a9d0d","required_control_tree_scan":"NONTRUNCATED_EXACT_G_TREE","release_to_generation_delta":["assignments/CAL-BR-009-v25-b53ab205.json","control/CAL-BR-009-v25-b53ab205.json","liveness/CAL-BR-009-v25-b53ab205.json"],"supersession_status":"ACTIVE_NOT_SUPERSEDED","worker_branch_prewrite_relation":"IDENTICAL_TO_G","report_path_prewrite":"ABSENT","auth_commitment_check":"PASS","schema_validation_runtime":"jsonschema==4.26.0","hmac_whole_report_check":"PASS","signed_field_mutation_check":"PASS","origin_reread":"NOT_PERFORMED_MM06_AUTHORITY"},"claim_scope":"Countable T0 replay-only transport and C1/product-gating semantics audit. No mathematical result, C1 score, VerifiedProduct admission, ProductUseCertificate decision, StatementFidelityCertificate, Stage0G activation, or scientific promotion is claimed.","runtime_implementation_implication":"Math Foundry 3.1.1 is bound as a qualified software replay substrate only. This receipt does not establish an eligible VerifiedProduct/ProductUseCertificate runtime instance, statement-fidelity admission, or C1 execution support.","negative_zero_outcomes":["C1=NOT_MEASURED","VERIFIED_PRODUCT_ADMISSION=NOT_CLAIMED","PRODUCT_USE_CERTIFICATE=NOT_EVALUATED","STATEMENT_FIDELITY_CERTIFICATE=NOT_PRODUCED","STAGE0G_ACTIVATION=NOT_CLAIMED","FRESH_EVIDENCE_UNITS=0","PRIVATE_MANIFEST_READS=0","BENCHMARK_EXECUTIONS=0","DEEP_RESEARCH_RUNS=0"],"research_questions":[],"cost_ledger":{"fresh_evidence_units_consumed":0,"protected_manifest_reads":0,"benchmark_executions":0,"deep_research_runs":0,"notes":"Replay/control-plane audit only. No protected or fresh scientific work and no C1 arm execution."},"public_safety_status":"PASS","origin_reread_claim":false,"next_action":"Wait for MM06 independent branch/report/blob/history reread and HMAC/schema verification; MF05 performs no second write, integration, promotion, or scientific-state mutation."}